{"artifacts":[{"path":"artifacts/macos-aarch64/facade.hpy0","sha256":"0000000000000000000000000000000000000000000000000000000000000000","size":1,"target":"macos-aarch64"}],"exports":[{"kind":"constructor","name":"Box","parameters":[{"call_kind":"positional-only","kind":"int64","name":"value","ownership":"value"}],"result":{"kind":"opaque-object","ownership":"owned"}},{"kind":"method","name":"Box.add","parameters":[{"call_kind":"positional-or-keyword","kind":"int64","name":"value","ownership":"value"}],"result":{"kind":"int64","ownership":"value"}},{"kind":"method","name":"Box.value","parameters":[],"result":{"kind":"int64","ownership":"value"}},{"kind":"module-function","name":"answer","parameters":[],"result":{"kind":"int64","ownership":"value"}},{"kind":"module-function","name":"echo_bytes","parameters":[{"call_kind":"positional-only","kind":"bytes","name":"payload","ownership":"value"}],"result":{"kind":"bytes","ownership":"value"}},{"kind":"module-function","name":"echo_float","parameters":[{"call_kind":"positional-only","kind":"float64","name":"value","ownership":"value"}],"result":{"kind":"float64","ownership":"value"}},{"kind":"module-function","name":"echo_int","parameters":[{"call_kind":"positional-only","kind":"int64","name":"value","ownership":"value"}],"result":{"kind":"int64","ownership":"value"}},{"kind":"module-function","name":"echo_text","parameters":[{"call_kind":"positional-only","kind":"unicode","name":"value","ownership":"value"}],"result":{"kind":"unicode","ownership":"value"}},{"kind":"module-function","name":"ratio","parameters":[],"result":{"kind":"float64","ownership":"value"}},{"kind":"module-function","name":"text","parameters":[],"result":{"kind":"unicode","ownership":"value"}},{"kind":"module-function","name":"truth","parameters":[],"result":{"kind":"bool","ownership":"value"}},{"kind":"module-function","name":"twice","parameters":[{"call_kind":"keyword-only","kind":"int64","name":"value","ownership":"value"}],"result":{"kind":"int64","ownership":"value"}}],"host":{"hpy_abi":"universal","hpy_version":"0.9","profile":"nox-hpy-host-v1","required_capabilities":["bytes","call-keywords","call-positional","error-take","extension-object","module-close","module-open","object-close"]},"module":{"init_symbol":"HPyInit_facade","name":"example.facade"},"package":{"name":"example_facade","version":"0.1.0"},"producer":{"ahpy_version":"3.3.0.1.dev0","compiler_options_digest":"1111111111111111111111111111111111111111111111111111111111111111","cython_base":"86b94cef002aa23aea0b390335ea3d9e9b62c19e","source_digest":"2222222222222222222222222222222222222222222222222222222222222222"},"schema_version":1}
