{"artifacts":[{"path":"artifacts/macos-aarch64/demo.hpy0","sha256":"aaaaaaaaaaaaaaaaaaaaaaaaaaaaaaaaaaaaaaaaaaaaaaaaaaaaaaaaaaaaaaaa","size":4096,"target":"macos-aarch64"}],"exports":[{"kind":"constructor","name":"Box","parameters":[{"call_kind":"positional-only","kind":"int64","name":"value","ownership":"value"}],"result":{"kind":"opaque-object","ownership":"owned"}},{"kind":"method","name":"Box.identity","parameters":[{"call_kind":"positional-only","kind":"int64","name":"value","ownership":"value"}],"result":{"kind":"int64","ownership":"value"}},{"kind":"module-function","name":"answer","parameters":[],"result":{"kind":"int64","ownership":"value"}}],"host":{"hpy_abi":"universal","hpy_version":"0.9","profile":"nox-hpy-host-v1","required_capabilities":["call-positional","error-take","extension-object","module-close","module-open","object-close"]},"module":{"init_symbol":"HPyInit_demo","name":"example.demo"},"package":{"name":"example_demo","version":"0.1.0"},"producer":{"ahpy_version":"3.2.0a0+ahpy.0","compiler_options_digest":"bbbbbbbbbbbbbbbbbbbbbbbbbbbbbbbbbbbbbbbbbbbbbbbbbbbbbbbbbbbbbbbb","cython_base":"86b94cef002aa23aea0b390335ea3d9e9b62c19e","source_digest":"cccccccccccccccccccccccccccccccccccccccccccccccccccccccccccccccc"},"schema_version":1}
